{"schemaVersion":1,"event":{"id":7,"year":2026,"name":"Santa Flyover 2026","statusId":3,"scheduledAt":"2026-12-22T01:00:00.000Z","wentLiveAt":"2026-12-22T01:02:11.000Z","endedAt":null,"fundsPercent":63,"flightHistory":{"routeId":3,"name":"2025 flight","points":[{"lat":46.8721,"lng":-114.0012,"recordedAt":"2025-12-22T01:31:07.000Z"},{"lat":46.873,"lng":-114.003,"recordedAt":"2025-12-22T01:31:37.000Z"}]},"routeMap":{"path":[{"lat":46.8721,"lng":-114.0012},{"lat":46.874032,"lng":-114.008311},{"lat":46.879514,"lng":-114.015027},{"lat":46.886203,"lng":-114.017446}],"timeline":[{"minutes":0,"lat":46.8721,"lng":-114.0012},{"minutes":5,"lat":46.874818,"lng":-114.009274},{"minutes":10,"lat":46.881297,"lng":-114.015672},{"minutes":12,"lat":46.886203,"lng":-114.017446}],"durationMinutes":12,"timed":true},"routeMapConfig":{"display":{"timeLabelIntervalMinutes":10,"routeWidth":"thick"},"controls":{"terrain":false}},"latestMessage":{"id":12,"body":"Santa is airborne over the valley.","createdAt":"2026-12-22T01:02:30.000Z"},"trackerBbox":{"west":-114.3,"south":46.75,"east":-113.8,"north":47.05},"trackerMap":{"id":3,"name":"Missoula valley","bbox":{"west":-114.75,"south":46.35,"east":-113.3,"north":47.25},"minZoom":0,"maxZoom":15,"terrainMaxZoom":15,"tilesUrl":"https://cdn.example/basemap/tiles.pmtiles","terrainUrl":"https://cdn.example/basemap/terrain.pmtiles"}},"qrCodes":{"qr-001":{"pageSlug":"sponsors","forwardUrl":null},"qr-002":{"pageSlug":"/","forwardUrl":null}},"sponsors":[{"id":4,"name":"Example Bakery","websiteUrl":"https://example.com","fbUrl":null,"igUrl":"https://instagram.com/example","logoMediaId":"8c1d5e2a-7b3f-4c9e-9a1d-2f6e8b4c0a11","latestYear":2026,"yearsAsSponsor":3,"lingerMs":12000}],"sponsorsYear":2026,"cookieTypes":[{"id":1,"name":"Chocolate chip","icon":{"source":"library","id":"cookie"},"sort":10},{"id":3,"name":"Gingerbread","icon":{"source":"media","id":"3b7e9c10-2d4f-4a8b-b6c1-9e0f7d5a2c33","display":{"sizePx":48,"shape":"circle"}},"sort":20}],"content":{"schemaVersion":1,"settings":{"siteName":"Western Montana Santa Flyover","tagline":"Santa flies over the valley every December.","homeNavLabel":"Track Santa","logo":{"source":"library","id":"sleigh"},"favicon":{"source":"library","id":"santa-hat"},"theme":{"snowDefault":true,"lightsDefault":true,"ornaments":true},"navExtraLinks":[],"footerLinks":[],"footerText":"A volunteer project.","contactEmail":null,"donateUrl":null,"analyticsEnabled":false,"headerLinks":[{"label":"Facebook","href":"https://www.facebook.com/WesternMontanaSantaFlyover","icon":{"source":"library","id":"facebook"},"newTab":true}]},"pages":[{"id":1,"slug":"no-event","title":"Off season","navLabel":null,"icon":null,"navPosition":0,"role":"no_event","sections":[{"id":1,"kind":"hero","presentation":{"width":"wide","align":"center","background":{"kind":"none"},"spacing":"normal","iconBefore":null,"iconAfter":null,"anchor":null},"data":{"title":"{event:name}","tagline":"Watch this space for Santa\u0027s next flight.","icon":{"source":"library","id":"helicopter"},"links":[],"height":"tall"},"items":[]},{"id":2,"kind":"latest_message","presentation":{"width":"wide","align":"start","background":{"kind":"none"},"spacing":"normal","iconBefore":null,"iconAfter":null,"anchor":null},"data":{"heading":"Latest update","style":"card"},"items":[]},{"id":3,"kind":"funds_ring","presentation":{"width":"wide","align":"start","background":{"kind":"none"},"spacing":"normal","iconBefore":null,"iconAfter":null,"anchor":null},"data":{"heading":"Cheer meter","caption":"How the fundraiser is doing.","size":"large","showYear":true},"items":[]},{"id":4,"kind":"route_preview","presentation":{"width":"wide","align":"start","background":{"kind":"none"},"spacing":"normal","iconBefore":null,"iconAfter":null,"anchor":null},"data":{"heading":"This year\u0027s route","disclaimer":null,"emptyText":"The route will appear here once it is set."},"items":[]},{"id":5,"kind":"sponsor_carousel","presentation":{"width":"wide","align":"start","background":{"kind":"none"},"spacing":"normal","iconBefore":null,"iconAfter":null,"anchor":null},"data":{"heading":"Thanks to our sponsors","logoWidth":480},"items":[]},{"id":6,"kind":"alerts_signup","presentation":{"width":"wide","align":"start","background":{"kind":"none"},"spacing":"normal","iconBefore":null,"iconAfter":null,"anchor":null},"data":{"heading":"Get alerts","copy":"We will email you when Santa is scheduled and when he lifts off.","signedOutCopy":"Sign in to sign up for alerts."},"items":[]}]},{"id":2,"slug":"planned","title":"Coming this December","navLabel":null,"icon":null,"navPosition":0,"role":"planned","sections":[{"id":7,"kind":"hero","presentation":{"width":"wide","align":"center","background":{"kind":"none"},"spacing":"normal","iconBefore":null,"iconAfter":null,"anchor":null},"data":{"title":"{event:name}","tagline":"Watch this space for Santa\u0027s next flight.","icon":{"source":"library","id":"helicopter"},"links":[],"height":"tall"},"items":[]},{"id":8,"kind":"latest_message","presentation":{"width":"wide","align":"start","background":{"kind":"none"},"spacing":"normal","iconBefore":null,"iconAfter":null,"anchor":null},"data":{"heading":"Latest update","style":"card"},"items":[]},{"id":9,"kind":"funds_ring","presentation":{"width":"wide","align":"start","background":{"kind":"none"},"spacing":"normal","iconBefore":null,"iconAfter":null,"anchor":null},"data":{"heading":"Cheer meter","caption":"How the fundraiser is doing.","size":"large","showYear":true},"items":[]},{"id":10,"kind":"route_preview","presentation":{"width":"wide","align":"start","background":{"kind":"none"},"spacing":"normal","iconBefore":null,"iconAfter":null,"anchor":null},"data":{"heading":"This year\u0027s route","disclaimer":null,"emptyText":"The route will appear here once it is set."},"items":[]},{"id":11,"kind":"sponsor_carousel","presentation":{"width":"wide","align":"start","background":{"kind":"none"},"spacing":"normal","iconBefore":null,"iconAfter":null,"anchor":null},"data":{"heading":"Thanks to our sponsors","logoWidth":480},"items":[]},{"id":12,"kind":"alerts_signup","presentation":{"width":"wide","align":"start","background":{"kind":"none"},"spacing":"normal","iconBefore":null,"iconAfter":null,"anchor":null},"data":{"heading":"Get alerts","copy":"We will email you when Santa is scheduled and when he lifts off.","signedOutCopy":"Sign in to sign up for alerts."},"items":[]}]},{"id":3,"slug":"scheduled","title":"Santa is on the way","navLabel":null,"icon":null,"navPosition":0,"role":"scheduled","sections":[{"id":13,"kind":"hero","presentation":{"width":"wide","align":"center","background":{"kind":"none"},"spacing":"normal","iconBefore":null,"iconAfter":null,"anchor":null},"data":{"title":"{event:name}","tagline":"Liftoff is scheduled for {event:scheduledAt}.","icon":{"source":"library","id":"helicopter"},"links":[],"height":"tall"},"items":[]},{"id":14,"kind":"countdown","presentation":{"width":"wide","align":"start","background":{"kind":"none"},"spacing":"normal","iconBefore":null,"iconAfter":null,"anchor":null},"data":{"heading":"Countdown to liftoff"},"items":[]},{"id":15,"kind":"latest_message","presentation":{"width":"wide","align":"start","background":{"kind":"none"},"spacing":"normal","iconBefore":null,"iconAfter":null,"anchor":null},"data":{"heading":"Latest update","style":"card"},"items":[]},{"id":16,"kind":"funds_ring","presentation":{"width":"wide","align":"start","background":{"kind":"none"},"spacing":"normal","iconBefore":null,"iconAfter":null,"anchor":null},"data":{"heading":"Cheer meter","caption":"How the fundraiser is doing.","size":"large","showYear":true},"items":[]},{"id":17,"kind":"route_preview","presentation":{"width":"wide","align":"start","background":{"kind":"none"},"spacing":"normal","iconBefore":null,"iconAfter":null,"anchor":null},"data":{"heading":"This year\u0027s route","disclaimer":null,"emptyText":"The route will appear here once it is set."},"items":[]},{"id":18,"kind":"sponsor_carousel","presentation":{"width":"wide","align":"start","background":{"kind":"none"},"spacing":"normal","iconBefore":null,"iconAfter":null,"anchor":null},"data":{"heading":"Thanks to our sponsors","logoWidth":480},"items":[]},{"id":19,"kind":"alerts_signup","presentation":{"width":"wide","align":"start","background":{"kind":"none"},"spacing":"normal","iconBefore":null,"iconAfter":null,"anchor":null},"data":{"heading":"Get alerts","copy":"We will email you when Santa is scheduled and when he lifts off.","signedOutCopy":"Sign in to sign up for alerts."},"items":[]}]},{"id":4,"slug":"live","title":"Santa is airborne","navLabel":null,"icon":null,"navPosition":0,"role":"live","sections":[{"id":20,"kind":"map","presentation":{"width":"full","align":"center","background":{"kind":"none"},"spacing":"normal","iconBefore":null,"iconAfter":null,"anchor":null},"data":{"defaultCenter":{"lat":46.87,"lng":-114},"defaultZoom":11,"controls":{"themePicker":true,"terrain":true,"snow":true,"flightHistory":true,"timeLabels":true,"location":true,"dataRow":true},"flightHistoryDefault":false,"overlays":{"liveIndicator":true,"liftoffTimer":true,"latestMessage":true,"leaderboardPanel":true,"sponsorCarousel":true,"cookieControl":true,"distanceChip":true}},"items":[]},{"id":21,"kind":"leaderboard","presentation":{"width":"wide","align":"start","background":{"kind":"none"},"spacing":"normal","iconBefore":null,"iconAfter":null,"anchor":null},"data":{"heading":"Cookie leaderboard","variant":"panel","emptyText":"Be the first to leave a cookie."},"items":[]}]},{"id":5,"slug":"ended","title":"Merry Christmas","navLabel":null,"icon":null,"navPosition":0,"role":"ended","sections":[{"id":22,"kind":"hero","presentation":{"width":"wide","align":"center","background":{"kind":"none"},"spacing":"normal","iconBefore":null,"iconAfter":null,"anchor":null},"data":{"title":"Merry Christmas!","tagline":"Thanks for flying with us this year.","icon":{"source":"library","id":"helicopter"},"links":[],"height":"short"},"items":[]